<?xml version="1.0" encoding="UTF-8"?>

<!-- TwinOtter project -->

<!--startup xmlns:xsi="http://www.w3.org/2001/XMLSchema-instance" xsi:noNamespaceSchemaLocation="http://whf/schema/inds_startup.xsd"-->
<startup xmlns:xsi="http://www.w3.org/2001/XMLSchema-instance" xsi:noNamespaceSchemaLocation="file:///C:/user/DryScan/nasa-dryden-dt/TwinOtter/inds_startup.xsd">
	
	<!-- Tomcat -->
	<!-- Don't start Tomcat under the Execution Manager -->
	<!--tomcat logFile="tommy.log">
		<input type="tcp" port="localhost:80" />
	</tomcat-->
	
	<!-- Server -->
	<del initialDirectory="Server" file="rbnb.log"/>
	<dataTurbine jvmMaxHeap="1024M" initialDirectory="Server" logFile="rbnb.log" name="INDS" address=":3333" tag="TwinOtter DT"/>
	<sleep duration_ms="15000"/>
	
	<!-- Jobs/KMLTrack -->
	<del initialDirectory="Jobs/KMLTrack" file="*.log"/>
	<trackKML initialDirectory="Jobs/KMLTrack" logFile="TrackKMLTwinOtter.log" consolidateResponse="true" noGUI="true" configFile="TrackKMLConfigTwinOtter.txt">
	    <plugin type="rbnb" port="localhost:3333" name="TrackKML_TwinOtter" />
	</trackKML>
	<trackData initialDirectory="Jobs/KMLTrack" logFile="TrackDataTwinOtter.log" noGUI="true" configFile="TrackDataConfigTwinOtter.txt">
	    <plugin type="rbnb" port="localhost:3333" name="TrackData_TwinOtter" />
	</trackData>
	<sleep duration_ms="2000"/>
	
	<!-- Jobs/TimeDrive -->
	<del initialDirectory="Jobs/TimeDrive" file="*.log"/>
	<timeDrive initialDirectory="Jobs/TimeDrive" logFile="timedrive.log" multiUserMode="ip">
	    <input type="tcp" port="4000"/>
	    <output type="tcp" port="localhost:80"/>
	</timeDrive>
	<sleep duration_ms="2000"/>
	
	<!-- Jobs/PlugIns -->
	<del initialDirectory="Jobs/PlugIns" file="*.log"/>
	<png initialDirectory="Jobs/PlugIns" logFile="png.log" width="320" height="200">
	    <plugin type="rbnb" port="localhost:3333" name="PNGPlugIn" />
	</png>
	<sleep duration_ms="1000"/>
	<toString initialDirectory="Jobs/PlugIns" logFile="toString.log">
	    <plugin type="rbnb" port="localhost:3333" name="ToString" />
	</toString>
	<sleep duration_ms="1000"/>
	<thumbNail initialDirectory="Jobs/PlugIns" logFile="thumbNail.log" scale="0.5" quality="0.9" maxImages="10">
	    <plugin type="rbnb" port="localhost:3333" name="ThumbNail" />
	</thumbNail>
	<sleep duration_ms="5000"/>
	
	<!-- TwinOtter Capture -->
	<del initialDirectory="Projects/TwinOtter" file="*.log"/>
	<!-- FOR LINUX -->
	<!--runProcess tag="TwinOtter-FlightAware" classification="source" initialDirectory="Capture/FlightMonitor" executable="/usr/bin/java" arguments="-cp ../../../INDS-Utility/FlightMonitor/FlightMonitor.jar:../../../INDS-Utility/FlightMonitor/saaj.jar:../../../INDS-Utility/FlightMonitor/activation.jar:../../../INDS-Utility/FlightMonitor/mail.jar com.rbnb.flight.FlightMonitor flightAwareTwinOtter.xml" />
	<runProcess tag="TwinOtter-SkyConnect" classification="source" initialDirectory="Capture/FlightMonitor" executable="/usr/bin/java" arguments="-cp ../../../INDS-Utility/FlightMonitor/FlightMonitor.jar:../../../INDS-Utility/FlightMonitor/saaj.jar:../../../INDS-Utility/FlightMonitor/activation.jar:../../../INDS-Utility/FlightMonitor/mail.jar com.rbnb.flight.FlightMonitor skyConnectTwinOtter.xml" /-->
	<!-- FOR WINDOWS -->
	<runProcess tag="TwinOtter-FlightAware" classification="source" initialDirectory="Capture/FlightMonitor" executable="C:\Program Files\Java\jre6\bin\java.exe" arguments="-cp ../../../INDS-Utility/FlightMonitor/FlightMonitor.jar;../../../INDS-Utility/FlightMonitor/saaj.jar;../../../INDS-Utility/FlightMonitor/activation.jar;../../../INDS-Utility/FlightMonitor/mail.jar com.rbnb.flight.FlightMonitor flightAwareTwinOtter.xml" />
	<runProcess tag="TwinOtter-SkyConnect" classification="source" initialDirectory="Capture/FlightMonitor" executable="C:\Program Files\Java\jre6\bin\java.exe" arguments="-cp ../../../INDS-Utility/FlightMonitor/FlightMonitor.jar;../../../INDS-Utility/FlightMonitor/saaj.jar;../../../INDS-Utility/FlightMonitor/activation.jar;../../../INDS-Utility/FlightMonitor/mail.jar com.rbnb.flight.FlightMonitor skyConnectTwinOtter.xml" />
	
</startup>
