<?xml version="1.0" encoding="UTF-8"?>

<!-- University of Wyoming King Air project -->

<!--startup xmlns:xsi="http://www.w3.org/2001/XMLSchema-instance" xsi:noNamespaceSchemaLocation="http://whf/schema/inds_startup.xsd"-->
<startup xmlns:xsi="http://www.w3.org/2001/XMLSchema-instance" xsi:noNamespaceSchemaLocation="file:///C:/user/DryScan/nasa-dryden-dt/UWyoKingAir/inds_startup.xsd">
	
	<!-- Tomcat -->
	<!-- Doesn't work with the new Tomcat (apache-tomcat-6.0.18) -->
	<!-- tomcat initialDirectory="Tomcat" logFile="tommy.log">
		<input type="tcp" port="localhost:80" />
	</tomcat>
	<sleep duration_ms="5000"/-->
	
	<!-- Server -->
	<del initialDirectory="Server" file="rbnb.log"/>
	<dataTurbine jvmMaxHeap="1024M" initialDirectory="Server" logFile="rbnb.log" name="INDS" address=":3333" tag="UWyoKingAir DT"/>
	<sleep duration_ms="15000"/>
	
	<!-- Jobs/KMLTrack -->
	<del initialDirectory="Jobs/KMLTrack" file="*.log"/>
	<trackKML initialDirectory="Jobs/KMLTrack" logFile="TrackKMLUWyoKingAir.log" consolidateResponse="true" noGUI="true" configFile="TrackKMLConfigUWyoKingAir.txt">
	    <plugin type="rbnb" port="localhost:3333" name="TrackKML_UWyoKingAir" />
	</trackKML>
	<trackData initialDirectory="Jobs/KMLTrack" logFile="TrackDataUWyoKingAir.log" noGUI="true" configFile="TrackDataConfigUWyoKingAir.txt">
	    <plugin type="rbnb" port="localhost:3333" name="TrackData_UWyoKingAir" />
	</trackData>
	
	<!-- Jobs/TimeDrive -->
	<del initialDirectory="Jobs/TimeDrive" file="*.log"/>
	<timeDrive initialDirectory="Jobs/TimeDrive" logFile="timedrive.log" multiUserMode="ip">
	    <input type="tcp" port="4000"/>
	    <output type="tcp" port="localhost:80"/>
	</timeDrive>
	
	<!-- Jobs/PlugIns -->
	<del initialDirectory="Jobs/PlugIns" file="*.log"/>
	<png initialDirectory="Jobs/PlugIns" logFile="png.log" width="320" height="200">
	    <plugin type="rbnb" port="localhost:3333" name="PNGPlugIn" />
	</png>
	<toString initialDirectory="Jobs/PlugIns" logFile="toString.log">
	    <plugin type="rbnb" port="localhost:3333" name="ToString" />
	</toString>
	<thumbNail initialDirectory="Jobs/PlugIns" logFile="thumbNail.log" scale="0.5" quality="0.9" maxImages="10">
	    <plugin type="rbnb" port="localhost:3333" name="ThumbNail" />
	</thumbNail>
	
	<sleep duration_ms="5000"/>
	
	<!-- Data Capture -->
	<del initialDirectory="Capture/UDPCapture" file="*.log"/>
	<udpCapture initialDirectory="Capture/UDPCapture" logFile="UWyoKingAir-50000-cap.log">
	    <input type="udp" port="50000"/>
	    <output type="rbnb" port="localhost:3333" cacheFrames="10" archiveFrames="8640000" overwriteArchive="false" name="UWyoKingAir-50000-cap"/>
	</udpCapture>
	<sleep duration_ms="5000"/>
	
	<!-- Project (demux) -->
	<del initialDirectory="Projects/UWyoKingAir" file="*.log"/>
	<xmlDemux initialDirectory="Projects/UWyoKingAir" logFile="XMLDemux.log" silentMode="true" chanNameFromID="true" xmlFile="demux.xml">
	    <input type="rbnb" port="localhost:3333" channel="UWyoKingAir-50000-cap/UDP"/>
	    <output type="rbnb" port="localhost:3333" cacheFrames="200" archiveFrames="1000000" overwriteArchive="false" name="UWYO_KING_AIR"/>
	</xmlDemux>
	
</startup>
